E-bulk Marketing Pvt Ltd,,4.0,92,"406, Lotus Plaza, 30 Meter Road, Gotri Road, Vadodara - 390021, Opposite Yash Complex, Near Vishranti Heritage",
T P Traders,,4.5,2,"B:-1/194, Badarpur, Delhi - 110044",
Global E Communications,,4.2,56,"H 21B, Basement, Kalkaji, Delhi - 110019, Near Desh Bandhu College",
DTS Soft India.com,,5.0,2,"RZ-5/5, Okhla Main Road, Tughlakabad Extension, Delhi - 110019",
Shree Vaishnavi Enterprises,,4.8,26,"613, 6TH Floor, Pukhraj Corporate, Navlakha, Indore - 452001, Infront Navlakha Bus Stand",
Gpswale.com,,4.6,11,"604, Prakash Tower, Yn Road, Indore - 452001, Opposite Rani Sati Gate",
Bombay Forensic,,4.3,62,"High Court, Second Floor, Jasia House, 137, Modi Street, Fort, Mumbai - 400001, Bombay High Court",
Mac Tech,,4.2,35,"G-1, Ground Floor, City Centre Apartment, Sultania Road, Bhopal - 462001, Bandmaster Square",
Nitin System & Securities,,3.5,2,"G-20 Johari Palace, MG Road, MG Road Indore, Indore - 452001, Near Treasure Island Mall",
Cosmos,,5.0,2,"9 , A/B , sector H , Govindpura industrial area, Govindpura, Bhopal - 462023",
Mittal Cyber Security,,4.3,188,"Office No.17-A, First Floor Mahaveer Dal Mandir, Birbal Chowk, Main Market, Sri Ganganagar Ho, Sri Ganganagar-Rajasthan - 335001, Near Purani Sabji Mandi",
Nakoda Enterprise,,4.6,6,"Chamunda Dream City, Shop No 12, Koparli Road, Koparli, Vapi - 396191, Near Saint Xavier",
K T Automation INDIA,,4.2,202,"D 32, Kamalanjali Complex, Radhakrishna Park Crossing, Akota, Vadodara - 390020, Above HDFC Bank",
Sharda Techno Commercial As..,,4.2,387,"Salasar J2, Cidco, Nanded - 431603, Opposite Water Tank Vaibhav Nagar",
Media Tech Temple,,4.6,203,"Building No D-124, Jawahar Nagar, Bharatpur Ho, Bharatpur - 321001",
Safety Wagon Automation IND..,,4.3,66,"B 26 New Siyaganj, Patthar Godam Mall, Godam Road, New Siyaganj, Indore - 452003, Near Chimney",
Hi Tech Networks,,3.7,23,"Hi Tech Business Park, Section 37, Thane - 400607, Opposite Diamond Hotel",
Dayal Computers,,4.9,7,"Shop No 6, Sarakari Parisar, Kalpana Nagar, Bhopal - 462022, Sahkari Parishar Phase 2",
Jvs Marketing,,4.3,56,"B 201, 2nd Floor, Swami Vistar Appartment, Bhamti Layout, Trimurti Nagar, Nagpur - 440022, Trimurti Nagar, Near Gajanan Mandir",
Poorti Telecommunication,,4.5,1,"Shop No.2,Plaza Market, Marhataal, Jabalpur, Jabalpur - 482001, Near Jayanti Complex",
Corporate Telesystems Pvt L..,,4.2,65,"Y-53, Okhla Industrial Area Phase -2, Okhla Industrial Area Phase 2, Delhi - 110020",
Bio Solutions,,4.6,166,"House No 5-4-101/B-1, S D Road, Kukatpally, Hyderabad - 500072, Near BJP Office,Kukatpally",
Krishna Industries,,4.0,36,"Gala No 147, Pragati Industrial Estate, N M Joshi Marg, Lower Parel, Mumbai - 400013, Near ZEE News Office",
Big Dream Info Services Pvt..,,4.1,57,"Building No-59, Office Mo-110, Emco Complex, Vijay Block, Delhi - 110034, Opposite Metro Pillar No-52 and Near Hira Sweet",
Aikon Telecom Pvt Ltd,,3.8,12,"64/2791 1st Floor Ganesh Krupa Chs Ltd, Gandhi Nagar, Bandra East, Mumbai - 400051, Near MIG Cricket Club Behind Samaj Mandir Hall",
Micro Software Solutions La..,,3.9,51,"R 14, First Floor, Laxmi Nagar, Delhi - 110092, Opposite Metro Pillar Number 43,  Shakarpur Main Market",
Electrica Automations,,4.8,42,"Kannika Nivas Vijaya Bank Colony, No 7, 5th Cross, Banaswadi, Bangalore - 560043, Near Banaswadi Bible Church",
Liveinsmart Technologies,,4.8,24,"H No:8-3-945 Flat No:208,Pancom Business Center, Ameerpet, Hyderabad - 500016, Opposite Chennai Shopping Mall",
ACC Infotech,,3.9,115,"2b,1st & 3rd Floor, Grant Lane, Bowbazar, Kolkata - 700012, Near Lal Bazar Thana",
Kalyas Security Solutions P..,,4.1,22,"Office No 301,Above Andhra Bank,Square Tower, Kanchana Bihari Marg, Gomti Nagar, Lucknow - 226010",
Kalyas Security Solutions P..,,4.1,22,"Office No 301,Above Andhra Bank,Square Tower, Kanchana Bihari Marg, Gomti Nagar, Lucknow - 226010",
TIME ACCESS,,4.4,6,"D-66,, Okhla Industrial Area Phase 1, Delhi - 110020",
Aqua Marketing,,4.0,29,"3rd Floor, 5,, Biplabi Anukul Chandra Street, Princep Street, Kolkata - 700072, Above Sabir Hotel",
Pace Solutions Madras,,4.6,11,"P 157 New No 25, 94th Street 15th Sector, K K Nagar, Chennai - 600078, Near Nagathaman Temple",
A R Solutions,,4.6,83,"3148/229, Shop Number-2, Tri Nagar, Delhi - 110035, Chander Nagar, Near Kanhaiya Nagar Metro Station",
Accutech Infosolution,,4.5,9,"E Wing 303 ,New Omkar Society, Vijay Park, Mira Road, Thane - 401107, Near Amber Plaza Banquet Hall",
The Advanced Communication ..,,4.1,10,"M1, D. No 7-15 , Flat No 3, 1st Floor, Sri Surya Arcade, Dwaraka Nagar, Visakhapatnam - 530016, Opposite Venkatramna Hospital",
Venus Systems N Solutions,,4.1,11,"102, Dimple Arcade,, Thakur Complex, Kandivali East, Mumbai - 400101, Behind Sai Dham Temple",
Infonet Solutions,,4.1,17,"9, Mohini Mohan Road, Lala Lajpat Rai Sarani, Kolkata - 700020, Near Jadu Bazar",
Origin Technology Associate..,,4.1,49,"No 12/25 1st Floor, New Colony Main Road, Adambakkam, Chennai - 600088, Above Tnsc Bank",
Big Dream Info Services Pvt..,,4.1,57,"Building No-59, Office Mo-110, Emco Complex, Vijay Block, Delhi - 110034, Opposite Metro Pillar No-52 and Near Hira Sweet",
Cognitive Enterprises,,3.6,4,"House Number 27, Mohali Sector 78, Mohali - 140308, Dolphin Tower",
Aegis Technologies,,4.5,76,"Door No 40-10-13A, Worksmen Pet, Nirmala Convent Road, Patamata, Vijayawada - 520010, Near NTR Circle",
Lansar Business Solutions,,4.8,16,"4th Floor, Shreenath Complex, Udhna Main Road, Udhna, Surat - 394210, Opposite Dream Honda",
Grab Deal Business Solution..,,4.3,50,"C1/197, Sector 11, Rohini, Delhi - 110085, Opp Cng Station",
S Plus Security Systems,,4.7,10,"Shop No-5, 1 St Floor, Central Market, Kalkaji, Delhi - 110019, Near GK -2",
Geon Solutions,,4.5,24,"2nd Floor, Flat No.5, Classic Plaza, Daba Gardens, Visakhapatnam - 530020, Near Saraswathi Park",
Tejas Telecommunication,,4.0,12,"B 703, Ankur Enclave, Mira Road, Thane - 401107, Near Vijay Park",
Pace Solutions Madras,,4.6,11,"P 157 New No 25, 94th Street 15th Sector, K K Nagar, Chennai - 600078, Near Nagathaman Temple",
Anvi Technologies,,5.0,1,"8-3-318 Vishnu Nivas Apartment, Engineers Colony, Sri Nagar Colony, Hyderabad - 500073, Jayaprakash Nagar,Yellareddy Guda",
Chartered Information Syste..,,4.7,175,"Chartered House 12 NIT Layout, Bhandara Road, Nagpur - 440035, Near West Of Lata Mangeshkar Music Park",
Geon Solutions,,4.5,24,"2nd Floor, Flat No.5, Classic Plaza, Daba Gardens, Visakhapatnam - 530020, Near Saraswathi Park",
TIME ACCESS,,4.4,6,"D-66,, Okhla Industrial Area Phase 1, Delhi - 110020",
S Plus Security Systems,,4.7,10,"Shop No-5, 1 St Floor, Central Market, Kalkaji, Delhi - 110019, Near GK -2",
Bio Tech Systems,,4.0,7,"M-4/203,Gupta Plaza, 2nd Floor, Vikaspuri, Delhi - 110018, Opp Kerala School",
Le Rayon International,,4.5,342,"301 Vikas Chamber Central Market, Prashant Vihar, Delhi - 110085, Near Pvr Cinema",
Sum Agitech Computer Servic..,,4.4,7,"House No 6-3, Rukmani Lane, Ameerpet, Hyderabad - 500016",
Sr Communications,,5.0,1,"Flat no -101 sharada elite appartment, Hmt swarnapuri colony, Madinaguda, Hyderabad - 500049, Community hall",
Prime Digital Corporation,,4.2,61,"132,Saraswati Chowk, Muraraji Peth, Solapur - 413002, Near Swastik Mithai",
Grab Deal Business Solution..,,4.3,50,"C1/197, Sector 11, Rohini, Delhi - 110085, Opp Cng Station",
Digital Check Lab,,4.6,12,"Hotel Shiva Commercial Complex 1st Floor, G S Road, Ulubari, Guwahati - 781007, Near Hotel Shiva",
Aegis Technologies,,4.5,76,"Door No 40-10-13A, Worksmen Pet, Nirmala Convent Road, Patamata, Vijayawada - 520010, Near NTR Circle",
Bk Secure Systems,,5.0,30,"Sector 77, Sohana, Mohali - 140308, 9 Secure Building",
Kis Management Pvt Ltd,,4.5,21,"D-MARN TOWER, DASHADRONE, Rajarhat Gopalpur, Kolkata - 700136, State Bank Of India",
Accutech Technologies Pvt. ..,,4.8,10,"8 / 9 Gokul Complex, Near Snaklap Hotel, Gurukul, Ahmedabad - 380052, Gurukul",
N D Infotech,,4.5,38,"N D INFOTECH, S-Block, Noida Sector 12, Noida - 201301, Near Metro Hospital",
Rdc Cctv Solutions,,4.6,51,"Old NIT Complax Shop No  5, Hill Road Gandi Nagar, Ramnagar, Nagpur - 440010, Near Maruti Suzuki Service Center",
